{
  "title": "PaperSim Rich Content Sample (Chemistry and Physics)",
  "subject": "Sciences",
  "durationMinutes": 45,
  "gradeBoundaries": {
    "1": 0,
    "2": 10,
    "3": 22,
    "4": 35,
    "5": 50,
    "6": 64,
    "7": 78
  },
  "resources": [
    "periodic-table",
    {
      "title": "Physics formulae",
      "content": "### Electricity\n\n| Quantity | Equation |\n|---|---|\n| Potential difference | $V = IR$ |\n| Power | $P = IV = I^{2}R = \\dfrac{V^{2}}{R}$ |\n| Resistors in series | $R_\\text{total} = R_1 + R_2 + \\dots$ |\n| Resistors in parallel | $\\dfrac{1}{R_\\text{total}} = \\dfrac{1}{R_1} + \\dfrac{1}{R_2} + \\dots$ |\n| Charge | $Q = It$ |\n\n### Motion and energy\n\n| Quantity | Equation |\n|---|---|\n| Speed | $v = \\dfrac{d}{t}$ |\n| Acceleration | $a = \\dfrac{v - u}{t}$ |\n| Equation of motion | $v^{2} = u^{2} + 2as$ |\n| Kinetic energy | $E_\\text{k} = \\tfrac{1}{2}mv^{2}$ |\n| Gravitational potential energy | $E_\\text{p} = mgh$ |\n\nGravitational field strength $g = 9.8\\ \\text{N kg}^{-1}$"
    },
    {
      "title": "Chemistry data",
      "content": "Molar gas volume at RTP: $24.0\\ \\text{dm}^{3}\\,\\text{mol}^{-1}$\n\n$n = \\dfrac{m}{M}$ · $n = \\dfrac{V}{24.0}$ (gas at RTP, $V$ in $\\text{dm}^{3}$) · $c = \\dfrac{n}{V}$",
      "table": {
        "caption": "Common ions",
        "headers": [
          "Positive ions",
          "Negative ions"
        ],
        "rows": [
          [
            "$\\ce{H+}$, $\\ce{Na+}$, $\\ce{K+}$, $\\ce{NH4+}$",
            "$\\ce{OH-}$, $\\ce{Cl-}$, $\\ce{NO3-}$"
          ],
          [
            "$\\ce{Mg^{2+}}$, $\\ce{Ca^{2+}}$, $\\ce{Cu^{2+}}$, $\\ce{Fe^{2+}}$",
            "$\\ce{O^{2-}}$, $\\ce{SO4^{2-}}$, $\\ce{CO3^{2-}}$"
          ],
          [
            "$\\ce{Al^{3+}}$, $\\ce{Fe^{3+}}$",
            "$\\ce{PO4^{3-}}$"
          ]
        ]
      }
    }
  ],
  "questions": [
    {
      "id": "1a",
      "task": "Task 1: Chemical equations",
      "criterion": "A",
      "marks": 2,
      "commandTerm": "Write",
      "context": "Magnesium ribbon reacts with dilute hydrochloric acid. Bubbles of a colourless gas are produced and the magnesium disappears.",
      "text": "Write the balanced symbol equation, **including state symbols**, for this reaction.",
      "markScheme": "$\\ce{Mg(s) + 2HCl(aq) -> MgCl2(aq) + H2(g)}$\n- correct formulae of all reactants and products [1]\n- balanced **and** correct state symbols [1]"
    },
    {
      "id": "1b",
      "task": "Task 1: Chemical equations",
      "criterion": "A",
      "marks": 2,
      "commandTerm": "Write",
      "context": "Sodium hydroxide solution is added to a solution containing iron(III) ions, $\\ce{Fe^{3+}}$. An orange-brown precipitate forms (Figure 1).",
      "images": [
        {
          "src": "data:image/svg+xml;utf8,%3Csvg%20xmlns%3D%27http%3A//www.w3.org/2000/svg%27%20viewBox%3D%270%200%20120%20200%27%20width%3D%27120%27%20height%3D%27200%27%3E%3Ctitle%3ETest%20tube%20with%20an%20orange-brown%20precipitate%3C/title%3E%3Cpath%20d%3D%27M40%2010%20V160%20a20%2020%200%200%200%2040%200%20V10%27%20fill%3D%27%23eef4fb%27%20stroke%3D%27%231a1d23%27%20stroke-width%3D%272%27/%3E%3Cpath%20d%3D%27M42%20120%20V160%20a18%2018%200%200%200%2036%200%20V120%20Z%27%20fill%3D%27%23b5651d%27/%3E%3C/svg%3E",
          "alt": "Test tube containing an orange-brown precipitate at the bottom",
          "caption": "Figure 1: the precipitate formed",
          "width": "120px"
        }
      ],
      "text": "Write the ionic equation, with state symbols, for the formation of the precipitate.",
      "markScheme": "$\\ce{Fe^{3+}(aq) + 3OH^-(aq) -> Fe(OH)3(s)}$\n- correct ions and product [1]\n- balanced charges **and** state symbols [1]"
    },
    {
      "id": "1c",
      "task": "Task 1: Chemical equations",
      "criterion": "A",
      "marks": 3,
      "commandTerm": "Explain",
      "context": "Ethanoic acid is a weak acid. In water it is only partly ionised:\n\n$$\\ce{CH3COOH(aq) <=> CH3COO^-(aq) + H+(aq)}$$",
      "text": "Solid sodium ethanoate, $\\ce{CH3COONa}$, is dissolved in the solution. Explain what happens to the position of equilibrium **and** to the pH.",
      "markScheme": "- sodium ethanoate adds $\\ce{CH3COO-}$ ions, increasing their concentration [1]\n- position of equilibrium shifts to the **left** (Le Chatelier's principle) [1]\n- $[\\ce{H+}]$ decreases, so the pH **increases** [1]\n\nFor reference (not required): $$K_a = \\frac{[\\ce{CH3COO-}][\\ce{H+}]}{[\\ce{CH3COOH}]}$$"
    },
    {
      "id": "1d",
      "task": "Task 1: Chemical equations",
      "criterion": "A",
      "marks": 1,
      "commandTerm": "Identify",
      "text": "Identify the correct formula of ammonium sulfate.",
      "options": [
        "$\\ce{NH4SO4}$",
        "$\\ce{(NH4)2SO4}$",
        "$\\ce{NH4(SO4)2}$",
        "$\\ce{(NH3)2SO4}$"
      ],
      "correctOption": "B",
      "markScheme": "**B**: $\\ce{(NH4)2SO4}$. Two $\\ce{NH4+}$ ions balance the charge of one $\\ce{SO4^{2-}}$ ion. [1]"
    },
    {
      "id": "2a",
      "task": "Task 2: Electricity and motion",
      "criterion": "A",
      "marks": 4,
      "commandTerm": "Calculate",
      "context": "The cell in Figure 2 has an emf $\\varepsilon = 6.0\\ \\text{V}$ and negligible internal resistance. $R_1 = 4.0\\ \\Omega$ and $R_2 = 8.0\\ \\Omega$.",
      "image": "images/series-circuit.svg",
      "imageAlt": "Series circuit with a cell, resistors R1 and R2, an ammeter and a voltmeter connected across R2",
      "imageCaption": "Figure 2: a series circuit",
      "text": "Calculate the reading on the ammeter **and** the power dissipated in $R_2$. Use $V = IR$ and $P = I^{2}R$.",
      "markScheme": "- $R_\\text{total} = R_1 + R_2 = 4.0 + 8.0 = 12\\ \\Omega$ [1]\n- $I = \\dfrac{\\varepsilon}{R_\\text{total}} = \\dfrac{6.0}{12} = 0.50\\ \\text{A}$ [1]\n- $P = I^{2}R_2 = (0.50)^{2} \\times 8.0$ [1]\n- $P = 2.0\\ \\text{W}$ [1]\n\nAllow error carried forward from an incorrect current."
    },
    {
      "id": "2b",
      "task": "Task 2: Electricity and motion",
      "criterion": "A",
      "marks": 3,
      "commandTerm": "Calculate",
      "context": "A ball of mass $m = 0.20\\ \\text{kg}$ is dropped from rest from a height $h = 5.0\\ \\text{m}$. Air resistance is negligible and $g = 9.81\\ \\text{m s}^{-2}$. While it falls, $\\vec{F}_\\text{net} = m\\vec{g}$.",
      "text": "Show that the speed of the ball just before it hits the ground is given by $v = \\sqrt{2gh}$, and calculate this speed.",
      "markScheme": "$$mgh = \\tfrac{1}{2}mv^{2} \\quad\\Rightarrow\\quad v = \\sqrt{2gh}$$\n- equates gravitational potential energy lost to kinetic energy gained [1]\n- $v = \\sqrt{2 \\times 9.81 \\times 5.0}$ [1]\n- $v = 9.90\\ \\text{m s}^{-1}$ (accept 9.9) [1]"
    },
    {
      "id": "3a",
      "task": "Task 3: Rate of reaction (data)",
      "criterion": "C",
      "marks": 2,
      "commandTerm": "Calculate",
      "context": "A student added marble chips to excess dilute hydrochloric acid and measured the volume of carbon dioxide collected:\n\n$$\\ce{CaCO3(s) + 2HCl(aq) -> CaCl2(aq) + H2O(l) + CO2(g)}$$",
      "table": {
        "caption": "Table 1: volume of $\\ce{CO2}$ collected",
        "headers": [
          "Time / s",
          "Volume of $\\ce{CO2}$ / cm$^{3}$"
        ],
        "rows": [
          [
            "0",
            "0"
          ],
          [
            "30",
            "24"
          ],
          [
            "60",
            "39"
          ],
          [
            "90",
            "49"
          ],
          [
            "120",
            "55"
          ],
          [
            "150",
            "58"
          ],
          [
            "180",
            "60"
          ],
          [
            "210",
            "60"
          ]
        ]
      },
      "text": "Calculate the mean rate of reaction in the first 30 s, in cm$^{3}$ s$^{-1}$.",
      "markScheme": "- $\\text{rate} = \\dfrac{24}{30}$ [1]\n- $= 0.80\\ \\text{cm}^{3}\\,\\text{s}^{-1}$ [1]"
    },
    {
      "id": "3b",
      "task": "Task 3: Rate of reaction (data)",
      "criterion": "C",
      "marks": 3,
      "commandTerm": "Analyse",
      "context": "Use Table 1 in question 3a.",
      "text": "Describe the trend in the data **and** explain it using collision theory.",
      "markScheme": "| Marking point | Mark |\n|---|:---:|\n| Rate is fastest at the start / volume rises quickly at first | [1] |\n| Rate decreases as the acid and marble are used up: fewer collisions per second | [1] |\n| Reaction stops at 60 cm$^{3}$ (180 s) when the limiting reactant ($\\ce{CaCO3}$) is used up | [1] |\n\nExpected shape of the graph:",
      "markSchemeImages": [
        {
          "src": "images/co2-volume-graph.svg",
          "alt": "Graph of volume of CO2 against time rising steeply then levelling off at 60 cm3",
          "caption": "Volume of $\\ce{CO2}$ against time",
          "width": "360px"
        }
      ]
    },
    {
      "id": "3c",
      "task": "Task 3: Rate of reaction (data)",
      "criterion": "C",
      "marks": 3,
      "commandTerm": "Calculate",
      "context": "Data booklet extract:\n\n| Quantity | Value |\n|---|---|\n| Molar gas volume at RTP | $24.0\\ \\text{dm}^{3}\\,\\text{mol}^{-1}$ |\n| $M_r$ of $\\ce{CaCO3}$ | 100.1 |\n| $1\\ \\text{dm}^{3}$ | $1000\\ \\text{cm}^{3}$ |",
      "text": "Calculate the mass of calcium carbonate that reacted, using the final volume in Table 1. Use the [periodic table](#resource:periodic-table) if you need relative atomic masses.",
      "markScheme": "- $n(\\ce{CO2}) = \\dfrac{60}{24\\,000} = 2.50 \\times 10^{-3}\\ \\text{mol}$ [1]\n- mole ratio $\\ce{CaCO3}:\\ce{CO2} = 1:1$, so $n(\\ce{CaCO3}) = 2.50 \\times 10^{-3}\\ \\text{mol}$ [1]\n- $m = 2.50 \\times 10^{-3} \\times 100.1 = 0.250\\ \\text{g}$ [1]"
    }
  ]
}